{
  "version": "1.0.0",
  "metadata": {
    "id": "ecommerce-order-processing-v1",
    "name": "E-Commerce Order Processing System",
    "description": "Complete order processing flow for an online retail platform with payment processing, inventory management, and fraud detection",
    "author": "Platform Engineering Team",
    "createdAt": "2025-12-27T10:00:00Z",
    "lastModified": "2025-12-27T15:30:00Z",
    "tags": ["e-commerce", "microservices", "order-processing", "payment"],
    "version": "2.1.0"
  },
  "nodes": [
    {
      "id": "client-web",
      "name": "Web Client",
      "type": "client",
      "position": { "x": 100, "y": 300 },
      "icon": "Globe",
      "shortDescription": "React-based web application for customer shopping",
      "detailedDescription": "# Web Client\n\n## Overview\nModern single-page application built with React 18 and TypeScript.\n\n## Features\n- Product browsing and search\n- Shopping cart management\n- User authentication (OAuth 2.0)\n- Order placement and tracking\n- Payment processing UI\n\n## Tech Stack\n- React 18.2\n- TypeScript 5.0\n- Redux Toolkit for state management\n- Tailwind CSS for styling\n- Vite for bundling",
      "metadata": {
        "status": "deployed",
        "owner": "Frontend Team",
        "version": "3.5.2",
        "criticality": "high",
        "tags": ["frontend", "react", "typescript", "spa"],
        "links": [
          { "url": "https://docs.example.com/web-client", "label": "Documentation" },
          { "url": "https://github.com/example/web-client", "label": "Repository" }
        ],
        "dateAdded": "2024-01-15T10:00:00Z",
        "dateModified": "2025-12-20T14:30:00Z",
        "author": "Frontend Team"
      }
    },
    {
      "id": "client-mobile",
      "name": "Mobile App",
      "type": "client",
      "position": { "x": 100, "y": 500 },
      "icon": "Smartphone",
      "shortDescription": "Native iOS and Android shopping applications",
      "detailedDescription": "# Mobile App\n\n## Overview\nCross-platform mobile application built with React Native.\n\n## Features\n- Native performance on iOS and Android\n- Push notifications for order updates\n- Biometric authentication\n- Offline cart persistence\n- AR product preview",
      "metadata": {
        "status": "deployed",
        "owner": "Mobile Team",
        "version": "2.8.1",
        "criticality": "high",
        "tags": ["mobile", "react-native", "ios", "android"],
        "dateAdded": "2024-03-10T09:00:00Z",
        "dateModified": "2025-12-15T11:20:00Z"
      }
    },
    {
      "id": "api-gateway",
      "name": "API Gateway",
      "type": "service",
      "position": { "x": 400, "y": 400 },
      "icon": "Shield",
      "shortDescription": "Main entry point with authentication and rate limiting",
      "detailedDescription": "# API Gateway\n\n## Responsibilities\n- JWT token validation\n- Rate limiting (1000 req/min per user)\n- Request routing to microservices\n- Response caching\n\n## Tech Stack\n- Node.js 20.x + Express.js 4.18\n- Redis for rate limiting\n- Kong Gateway\n\n## Performance\n- Avg response time: 15ms\n- 99.99% uptime SLA",
      "metadata": {
        "status": "deployed",
        "owner": "Platform Team",
        "version": "4.2.0",
        "criticality": "critical",
        "tags": ["gateway", "auth", "nodejs"],
        "links": [
          { "url": "https://docs.example.com/api-gateway", "label": "API Docs" }
        ],
        "dateAdded": "2023-11-20T08:00:00Z"
      }
    },
    {
      "id": "auth-service",
      "name": "Auth Service",
      "type": "service",
      "position": { "x": 700, "y": 250 },
      "icon": "Lock",
      "shortDescription": "User authentication and authorization service",
      "detailedDescription": "# Authentication Service\n\n## Features\n- OAuth 2.0 / OpenID Connect\n- Multi-factor authentication (MFA)\n- Role-based access control (RBAC)\n\n## Tech Stack\n- Java 17 + Spring Boot 3.1\n- Spring Security\n- PostgreSQL + Redis",
      "metadata": {
        "status": "deployed",
        "owner": "Security Team",
        "version": "3.1.5",
        "criticality": "critical",
        "tags": ["auth", "security", "java"],
        "dateAdded": "2023-10-05T12:00:00Z"
      }
    },
    {
      "id": "decision-auth-check",
      "name": "Auth Valid?",
      "type": "decision",
      "position": { "x": 700, "y": 400 },
      "icon": "GitBranch",
      "shortDescription": "Validates user authentication token",
      "detailedDescription": "# Authentication Check\n\nValidates JWT token:\n- Token expiration\n- Token signature\n- User permissions\n- Account status",
      "metadata": {
        "status": "deployed",
        "owner": "Security Team",
        "criticality": "critical",
        "tags": ["decision", "auth"],
        "dateAdded": "2024-01-20T10:00:00Z"
      }
    },
    {
      "id": "order-service",
      "name": "Order Service",
      "type": "service",
      "position": { "x": 1000, "y": 400 },
      "icon": "ShoppingCart",
      "shortDescription": "Manages order creation and lifecycle",
      "detailedDescription": "# Order Service\n\n## Responsibilities\n- Order creation and validation\n- Order status tracking\n- Order history and notifications\n\n## Tech Stack\n- Python 3.11 + FastAPI\n- PostgreSQL (100M+ orders)\n- RabbitMQ + Redis",
      "metadata": {
        "status": "deployed",
        "owner": "Order Management Team",
        "version": "5.3.1",
        "criticality": "critical",
        "tags": ["orders", "python", "fastapi"],
        "links": [
          { "url": "https://docs.example.com/order-service", "label": "API Docs" }
        ],
        "dateAdded": "2023-12-01T08:30:00Z"
      }
    },
    {
      "id": "inventory-service",
      "name": "Inventory Service",
      "type": "service",
      "position": { "x": 1300, "y": 250 },
      "icon": "Package",
      "shortDescription": "Real-time inventory and stock management",
      "detailedDescription": "# Inventory Service\n\n## Features\n- Real-time stock checking\n- Stock reservation\n- Multi-warehouse support\n- Low stock alerts\n\n## Tech Stack\n- Go 1.21\n- PostgreSQL + Redis\n- 10K checks/second, <20ms response",
      "metadata": {
        "status": "deployed",
        "owner": "Supply Chain Team",
        "version": "4.0.2",
        "criticality": "high",
        "tags": ["inventory", "golang"],
        "dateAdded": "2024-02-15T11:00:00Z"
      }
    },
    {
      "id": "decision-stock-available",
      "name": "Stock Available?",
      "type": "decision",
      "position": { "x": 1300, "y": 400 },
      "icon": "GitBranch",
      "shortDescription": "Checks if items are in stock",
      "detailedDescription": "# Stock Check\n\nValidates:\n- Sufficient quantity\n- Item not discontinued\n- Warehouse location",
      "metadata": {
        "status": "deployed",
        "owner": "Supply Chain Team",
        "criticality": "high",
        "tags": ["decision", "inventory"],
        "dateAdded": "2024-02-20T09:00:00Z"
      }
    },
    {
      "id": "fraud-detection",
      "name": "Fraud Detection",
      "type": "service",
      "position": { "x": 1000, "y": 600 },
      "icon": "AlertTriangle",
      "shortDescription": "ML-based fraud detection and risk scoring",
      "detailedDescription": "# Fraud Detection\n\n## Risk Scoring\n- ML models (Random Forest + XGBoost)\n- Velocity checks\n- Geolocation analysis\n- Device fingerprinting\n\n## Thresholds\n- Low: <20 (auto-approve)\n- Medium: 20-70 (review)\n- High: >70 (reject)",
      "metadata": {
        "status": "deployed",
        "owner": "Risk Team",
        "version": "2.7.3",
        "criticality": "high",
        "tags": ["fraud", "ml", "python"],
        "dateAdded": "2024-05-10T10:00:00Z"
      }
    },
    {
      "id": "decision-fraud-check",
      "name": "Fraud Score OK?",
      "type": "decision",
      "position": { "x": 1300, "y": 600 },
      "icon": "GitBranch",
      "shortDescription": "Evaluates fraud risk score",
      "detailedDescription": "# Fraud Evaluation\n\nChecks:\n- ML model score\n- Customer history\n- Risk threshold (<70)",
      "metadata": {
        "status": "deployed",
        "owner": "Risk Team",
        "criticality": "high",
        "tags": ["decision", "fraud"],
        "dateAdded": "2024-05-15T12:00:00Z"
      }
    },
    {
      "id": "payment-service",
      "name": "Payment Service",
      "type": "service",
      "position": { "x": 1600, "y": 400 },
      "icon": "CreditCard",
      "shortDescription": "Multi-gateway payment processing",
      "detailedDescription": "# Payment Service\n\n## Payment Methods\n- Credit/Debit (Stripe, Braintree)\n- PayPal, Apple Pay, Google Pay\n- BNPL (Klarna, Affirm)\n\n## Features\n- PCI DSS Level 1 compliant\n- 3D Secure authentication\n- 150+ currencies",
      "metadata": {
        "status": "deployed",
        "owner": "Payments Team",
        "version": "6.1.0",
        "criticality": "critical",
        "tags": ["payments", "java", "pci-dss"],
        "links": [
          { "url": "https://docs.example.com/payment-service", "label": "API Docs" }
        ],
        "dateAdded": "2023-11-15T09:00:00Z"
      }
    },
    {
      "id": "decision-payment-success",
      "name": "Payment Success?",
      "type": "decision",
      "position": { "x": 1900, "y": 400 },
      "icon": "GitBranch",
      "shortDescription": "Validates payment result",
      "detailedDescription": "# Payment Validation\n\nChecks:\n- Authorization status\n- Sufficient funds\n- 3D Secure verified",
      "metadata": {
        "status": "deployed",
        "owner": "Payments Team",
        "criticality": "critical",
        "tags": ["decision", "payment"],
        "dateAdded": "2024-01-05T10:00:00Z"
      }
    },
    {
      "id": "notification-service",
      "name": "Notification Service",
      "type": "service",
      "position": { "x": 2200, "y": 300 },
      "icon": "Bell",